book_name,parsha_name,dvar_torah_id,passage_id,passage_content
Divrey Yoel,Shemot,32,367,"ויהיבימים ההם ויגדל משה ויצא אל אחיו ויראבסבלותםוירא איש מצרי מכה איש עברי מאחיו,יל""דעל כפל מלת איש ב' פעמים, ויספיק לומר מצרי מכה עברי, ובכל מקום מלת איש לדרשה אתי' כמ""ש אין איש אלא משה, אין איש אלא הקב""ה ועודבכ""מוצ""בהכוונה בזה."
Divrey Yoel,Shemot,32,368,"ב)צ""במ""שמאחיו ובאומרו עבריידענאשהוא מאחיו,ובאוהחה""קפי' דקדק לומר מאחיו ירמוז כי הביט שהי' מהצדיקים שבישראלוכו', ותמצא שכאשר אמר בסמוך ב' אנשים עבריםנצים, לא אמר מאחיו לטעם שהיו רשעים כי הם דתן ואבירם עכ""ל, אמנםבמד""ר(פ' א' ס""ס כ""ח) איתא שזה המוכה הי' דתן. והמצרי בא על אשתו של דתן שלומית בת דברי, ואחר שידע המצרי שהרגיש בו בעלה רצהלהרגו, עיי""ש במפרשי המדרשים דיש רוצים למחוק אשתו של דתן, אולם בספרים שלפנינו כך הואהגירסא,ולפי""זהי' המוכה רשעוצ""במ""שמאחיו."
Divrey Yoel,Shemot,32,369,"ג)ויצא אל אחיו ויראבסבלותםמיותר,דמאומרווירא איש מצרי מכה איש עברי וגו',ידענאשיצא אל אחיו וראהבסבלותם."
Divrey Yoel,Shemot,32,370,"ד)כה וכה וירא כי אין איש וגו'במד""רר'יהודאאומר וירא כי אין איש שיקנא להקב""ה ויהרגנווכו', ורבנן אמרי ראה שאין תוחלת של צדיקים עומדת הימנו ולא מזרעו עד סוף כל הדורות, ולכאורה צ""ב מה שתמהמרע""הואמר אין איש שיקנא להקב""הוכו', והרי גםמרע""הלא הרגו עד שצפה בסוף כל הדורות שאין תוחלת של צדיקים עומדת ממנו, ומי כמוהו ידע להתבונן ולהבחין בזה, ובאבותדר""נ(פ""כ) איתא שהושיב משהסנהדראותשלמלה""ש, וא""ל אהרוג את זה ואמרו לו הרוג והרגו בשם המפורש, א""כ לא הי'חיובאזורמיאעל כל ישראל כי לא הי'ראויםלמעשה זו זולתו, גם שהי' צ""ל בהסתרובצינעאמפני הסכנהוצ""ב."
Divrey Yoel,Shemot,32,371,"ה)זוה""ק(תיקון ו') דרשו ויפן כה וכה וירא כי אין איש, אלא איש לדרכו פונה וכו' איש לבצעולירתאהאי עלמא וכו'כולהוצווחין הב הב לנאמזונאוסליחה וכפרה וכו'וצ""בשהוציאו המקרא מפשוטו לגמרי,דמייריבהריגת מצרי שרצה להרוג ישראל, ואין מקרא יוצא מידי פשוטו לעולם."
Divrey Yoel,Shemot,32,372,"ונראהבביאורהעניןדהנהמרע""הבהכאתו המצרי הביט עד סוף כל הדורות כמבואר בדברי המדרש, והנהאמרז""לשכל הגליות הם להשלים גלות מצרים שלא נשלם אז, ושורש כולם גלות מצרים,ובש""ךעה""תפ' זו כתב שכל אלו הנשמות המגולגלים עד סוף כל הדורות, היו כולם שם בגלות מצרים,ויע""אראה לפניו ס'רבואמבני בניו וכו' ודור הראשון שנסתלקו אז במצרים הם הסובלים עתה החבלי משיחוכו', וכולנו יוצאי מצרים, וכל אלו שיגאלו בביאת המשיח כולם היו שםוכו', והראי'דעלשאר הנסים מברכים שעשית לאבותינו, אבלביצי""מכתיב אשר הוצאתיך מארץ מצרים בלשון יחיד,שהבוכ""עהוציא משם כל נשמות ישראל עד סוף כל הדורות, ועמדו כולן במעמד הנבחר ולכאו""א אמרהבוי""תאשר הוצאתיךמארמ""צוכולנו יוצאי מצרים וכו'יעיי""שבאריכות, וע""כמרע""הכשהביט עד סוף כל הדורות השיג ברוה""ק השתלשלות כל הדורות וגלגלותיהם, ויובן בזה אריכות לשון הכתוב ויצא אל אחיו ויראבסבלותם, ע""דשאמה""כויוצא אותו החוצהשדרז""להוציאו למעלה מכיפת הרקיע, וכמו""כ ויצא אל אחיו שיצא למעלה מגלגל העולם לראות אחיו, ויראבסבלותםשראה בסבלות ישראל עד סוף כל הדורות,ולז""אוירא ""איש"" מצרי מכה ""איש"" עברי מאחיו, כי אז מצרי הכה יהודי, אולם ראה עד סוף כל הדורות והשיג אף בחי' הגלות של עכשיו,שבעוה""רהגענו עד כדי כך שלא המצרי בלבד מכה עברי, אבל גם איש מצרי מכה איש עברי מאחיו, ר""ל שהוא מאחיו וישראל כמוהו אלא שעושה מעשה מצרי ומתדמה אליו, ונקרא איש מצרי ע""ש שהוא מאנשיהם ונטפל לדרכיהם ושיטתם, והוא מכה איש עברי המתרחק מדרכי הרשעים, שנקרא איש עברי ע""ד שאמרו ז""לבאאע""הלמה נקרא שמו עברי שכל העולם עומד בעבר האחד והוא בעבר השני, ואמר ""איש"" עברי ע""ד שכתב ק""זזלה""הביש""מ(פ' בלק) דאף מי שאינו צדיק גמור רק שמתחבר לצדיקים והולך בדרכם הוא ג""כ שנוא בעיני הרשעים, והוא שומה מאת ה' שיהי' שנאה כבושה בין צדיק לרשעיעיי""ש."
Divrey Yoel,Shemot,32,373,"והנהאמרז""ל(סנהדרין ק""ט) דתן שעבר על דת אל אבירם שאיבד עצמו מעשות תשובה, וראוי להבין למהפלגינהוזה לדת וזה לתשובה, והצדהשוהשבהן לא טוב, ופירשתי עפ""ימאמה""כ(תהלים ק""ו)תפתח ארץ ותבלע דתןותכסעל עדת אבירם,וצ""בלמהפלגינהוקראדאצלדתן כתיב ותבלע וגם לא כתיב עדת דתן, ואצל אבירם כתבותכסוהזכיר גם עדת אבירם, ומדוע לאכיילינהויחדיו תפתח ארץ ותבלע אוותכסעדת דתן ואבירם, ויבוארעפי""דהגמ' (סנהדרין ק""ט:) און בןפלתאשתוהצילתו,דישבהבפתח ביתה וסתרה לשערות ראשה, אמרהידענאכי כל העדה כולם קדושים וכלדאתאחזי' הדר,והרחוקועצמן מפתח ביתהועי""זניצול בעלה מחבורתם, מבואר מזה כי בדור ההוא אפי' הגרועים שבישראל לא נכנסו לבית שהתנהגו בו בפריצות והתרחקו מחבורתם ולא הי' אפשר להתעות את ישראל במתישואכמובדורינו, והנה לפיגירסתהמדרש הנ""ל שאחתקילקלהופירסמההכתובהיתהאשתו של דתן, א""כ הרי נתגדל הנוקב שם ה' בביתו של דתן וכיון שבביתו נתגדל נוקב שם ה'בודאיהי' בית פרוץ ומקולקל, ע""כ דתן לא הי'ביכלתולהמשיך אליו עדה,משא""כאבירם שלא הי' אצלו כ""ז הוא הי' יכול להמשיך אחריו עדה, ממילא דתן שלאהי""לעדה ע""כ תפתח ארץ ותבלע דתן, וזה יספיקלהרחיק הנזק, אבל ""ותכס"" על ""עדת"" אבירם, כי הוא המשיך אליו בנ""א והאמינו בו, ע""כ לא יספיק מה שיבלעהו הארץ כי עדייןישארובעולםדיעותיומה שהכניס בלב ההמוןדיעותנפסדות, ע""כ אמרותכסעל עדת אבירם שהי' צורך שיתכסה ויתעלם מן העולם גם עדתו נושאי שיטתוודיעותיו, ובזה יובן דבריהגמ' סנהדרין הנ""ל, כי דתן הי' רק עזב דת קל שהרשיע לעצמו,משא""כאבירם חטא והחטיא את הרבים עמו,ואמרז""לכי אחד מןהכ""דדברים המעכבים את התשובה המחטיא את הרבים, ואיתא בספר חסידים באחד שהחטיא את הרבים וביקש לסדר לו תשובה, א""ל החכם הביא חזרה כל הנשמות שקלקלת, ואם אינך יכול להחזירם א""א לסדר לך תשובה, כי מה בצע בתשובתך כ""ז שהם אינם שבים וע""כ באבירם שהמשיך אחריו עדה וגרםלקילקולםא""א לו לעשות תשובה, ובזה יונח כי בדתן דרשו ז""ל שעזב דת קל, ובאבירם שאיבד עצמו מן התשובה, ע""י שהמשיך אליו בנ""א והחטיא את הרבים."
Divrey Yoel,Shemot,32,374,"ולפי""זאפ""לדעפ""יפשוטו מלת מאחיוקאיעל המצרי, שהשיגמשרע""השהמוכה דתן רשע כמותו ואחיו לובדיעה, וע""ד הרמז ראה בדורות העתידים שיהי' איש מצרי מכה איש עברי מאחיו, ישראל כמוהו אלא שעושה מעשה מצרי כנ""ל, וירדוף אחריולהכהובהכאה גשמיות ורוחניות, וכל כוונתו להמשיכולדיעותיוולעשוק את נפשו כדרך המסיתים בדורנו שמנסים בכלי קרב ובדרך מלחמה להכניע, ואח""כ באים בחלקלקות לשון לפתות ר""ל לדעתם ושיטתם, וע""ד שכתב הרמב""ם ז""ל עה""פ כל כלי יוצר עליך לא יצלח וכל לשון תקום אתך למשפט תרשיעי,דהכוונהעל ב' דרכי הסתה הנ""ל עיי""ש וכל זה ראהמשרע""הברוה""ק והתפלל על הצלתינו מידם ועשה פועל דמיוני לזה, וז""אויךאת המצרי ויטמנהו בחול, וע""ד שאמרדוהמע""התפתח ארץ ותבלע דתןותכסעל עדת אבירם, וכמו שפירשנו לעיל שיתעלם ויתכסה מן העולם הם ועדתם ונושאי שיטתם, ולא ירעו ולא ישחיתו וגו'"
Divrey Yoel,Shemot,32,375,"ועד""זיתבאר דברי המדרש הנ""ל (בקושיאד') ר' יהודה אומר וירא כי אין איש שיקנא להקב""הוכו',ומ""שבתיקונים וירא כי אין איש אלא לדרכו פונהוכו', ועפ""י דרשתם ז""ל ירמוז הכתוב לדורות וז""א ויפן כה וכה וירא כי אין איש, ע""ד שהתפללמשרע""היפקוד ד'אלקיהרוחות וגו' איש על העדה וגו', ונענה על אותה שעה וא""ל הקב""ה קח לך את יהושע וגו' איש אשר רוח בו, אמנם צפהמשרע""הבסוף הדורות שיהיו ישראל כצאן בלא רועה ובלא מנהיג, וע""ז מקונן הנביא (יחזקאל ל""ד) הוי רועי ישראל וגו' את החלב תאכלו וגו' הצאן לא תרעו וגו' ישגו צאני בכל ההרים וגו' ועל כל פני הארץ נפוצו צאני ואין דורש ואין מבקש כה אמר ד' הנני אל הרועים ודרשתי צאני מידם והשבתים מרעות צאן ולא ירעו עוד הרועים אותם והצלתי צאני מפיהם וגו' אני ארעה צאני ואני ארביצם נאם ד' וגו'והקימותיעליהם רועה וגו' את עבדי דוד הוא ירעה אותם והוא יהי' להם לרועה, וכל הנבואה הזו התנבא יחזקאל על הדור האחרוןעיקבתאדמשיחא, ונתקיימה במלואהבעוה""ר, שאין מי יגדור גדר ומי יעמוד בפרץ, ואמרו חז""ל (סנהדריןצ""ז ע""א) דור שבן דוד בא העזות תרבה והיוקר יעוותפרש""יהיוקר יעוות מכובד שבהן יהא עוותן ורמאי, ולכאורה הריאמרז""ל(פסחים ג') בגנות בהמה טמאה לא סיפר הכתוב וכו' עיי""ש, ומדוע יאריך הכתוב לספר בגנות רועי ישראל ואף חז""ל תיארו גנותם, אמנם הי' הכרח לזה מפני הצלת הדורות, ולהודיע לנו שאין לנו על מילהשעןאלא על אבינו שבשמים, ולא נניח להתעות עצמינו, וכמ""ש רש""י ז""ל בשה""ש עה""פ אם לא תדעי לך היפה בנשים צאי לך בעקבי הצאן.וזלה""קאם פסק הרועהמלהנהיגך, צאי לך בעקבי הצאן תסתכלו בפסיעות שבו הלכו הראשונים והעקביים נכרים, ואם נבקש דרך האמת דרךאבוה""קלא יעזוב ד' את ישראל וירחם עלינולהנחינובדרך האמת."
Divrey Yoel,Shemot,32,376,"ובזהיתבארו דבריהתקוניםויפן כה וכה וירא כי אין איש, אלא איש לדרכו פונה וכו' איש לבצעולירתאהאי עלמא,כולהוצווחין הב הב לנאמזונאוסליחה וכפרה, ולכאורה הרי אנשיכנה""גתיקנו להתפלל על כל אלה, אמנםהזוה""קאין תרעומתו על בקשתמזונאפרנסה חיי סליחהוכו', כי בני ישראל צריכים לכל זה בשביל להרבות כבוד שמים בעולם,ועד""זתיקנו אנשיכנה""גלהתפלל על אלהשיתכוויןהאדם בתפלתו בשביל כבוד שמים ובשביל שיתרחב דעתו לעבוד ד' בכל לבבו, ויהי' לו די מחסורו להחזקת תלמוד תורה ולקיים מצות התלויים בממון. אולםהחסרוןהוא שאין בנ""א מכוונים כ""א להנאתן,וז""שצווחיןככלביןהב לנאמזונאוכו' כי הכלבים ג""כצועקיןרק להנאת עצמן. וזהו כלהחסרוןשצווחיןככלביןבדומה להם, וצריךלכוויןבעד כבוד שמים."
Divrey Yoel,Shemot,32,377,"וע""זירמזו דברי רז""ל במדרש וירא כי אין איש שיקנא להקב""ה וכו' שידרוש בשביל כבוד שמוית' להכניע כוחות הטומאה, כמו שעשהמשרע""הבהריגת המצרי,וק""זהייט""לזלה""הפי'מ""שפניתי לימין ואין עוזר ולשמאל ואין סומך, כיהתוה""קנקראת ימיןעדה""כמימינו אש דת למו, ובדורות האחרונים אין לנו עוזר וסומךמבלעדוית""ש, וז""א פניתי לימין לבקש עזר וסעד בעבדות ד' ודרךהתוה""ק, ואין עוזר, כי אפסו מנהיגי ישראל האמיתיים, ולשמאל לבקש טובה בהשפעה גשמיות ע""ד הכתוב בשמאלה עושר וכבוד ואין סומך, וזה ירמוז הכתוב ויפן כה וכה כבחי' הנ""ל וירא כי אין איש. שראהמשרע""הבשפלות דורנו האחרון שלא יהי' לנו לא מנהיג ולא מנהל ויראבסבלותםעד סוף כל הדורות, והתפלל על הצלתינו."
Divrey Yoel,Shemot,33,378,"ויהיבימים הרבים ההם וימת מלך מצריםויאנחובני ישראל מן העבודה ויזעקו ותעלשועתםאלהאלקיםמן העבודה,פרש""יז""לנצטרעוהי' שוחט תינוקות של ישראל ורוחץ בדמם, וכן מבוארבמד""ר(פר' א' סי' ל""ד) למהנתאנחו, לפי שאמרו חרטומי מצרים אין לך רפואה אם לאנשחוטמקטני ישראל ק""נ בערבוק""נבבוקר ורחוץ בדמיהם שתי פעמים ביום, כיון ששמעו ישראל גזירה קשה התחילו מתאנחים וקוננים, ראוי להביןדלכאורהדרש זה סותר משמעותהפשוטושאנחתם הי' מן העבודה,דכתיבויאנחובנ""ימן העבודה, ואם כדרשתםשנתאנחועל איבוד הנפשות מדוע כתיב מן העבודה, גם אין טעם בעצה זו לרחוץ בדמם של תינוקות דבר שלא נשמע מעולם, ואם הי' צריך לדם תינוקות הי' יכול להקיז מהם דם, ומדועדוקאבבוקר ובערב."
Divrey Yoel,Shemot,33,379,"ונל""פבדרך רמז מוסר בהקדם דבריהגמ' (נדה י""ג ע""א) ואמר ר' יוחנן כל המוציא ש""ז לבטלה חייב מיתה וכו' ר' יצחק ור' אמי אמרו כאילו שופך דמים שנאמר (ישעי' נ""ז)הנחמיםבאלים תחת כל עץ רענן שוחטי הילדים בנחלים תחת סעיפי הסלעים, אל תקרי שוחטי אלא סוחטי עכ""דהגמ', ורש""י ז""לבישעי' שם פי' שוחטי הילדים לקרבן עכו""ם, וכן פירשו רוב מפרשים שוחטי הילדים לע""ז, שבימיהם הי'יצראדע""זתקיפאוגם את בניהם ואת בנותיהם ישרפון באשלאלהיהם, ובגמ' דרשוהו על חטא הידוע, עוד שם בגמראאר""אמ""ד גם כי תרבו תפלה אינני שומע ידיכם דמים מלאו (ישעי' א'), אלו המנאפים ביד,פרש""ימוציא זרע לבטלה, וכ'המהרש""איש לפרש דלפי פשוטו שהוא שפיכתדמים ממש למה תלה בו גם כי תרבו תפלה איננו שומע יותר מבשאר עבירות, אבל הרהור עבירה הוא ודאי ביטול תפלה, וביותר במוציא שז""ל שאסור להתפלל עד שיטבול עכ""ד, ולכאורה יש להבין מה שכתבדהרהורעבירה הוא ודאי ביטול תפלה,דא""כיהי' בכל הרהור עבירה כן ולמהדוקאבחטא זה, ואולידבהרהורשאר עבירות אינו מפסיד כ""כ כוונת התפלה כמו בהרהור זה, או אפשרעפי""מדאיתאשם בגמראאר""אכל המביא עצמו לידי הרהור איןמכניסיןאותו במחיצתו של הקב""ה, כתיב הכא וירע בעיני ה' וכתיב התם כי לא אל חפץ רשע אתה לאיגורךרע עכ""דהגמ', וכמו שהוא עצמו נדחה ממחיצתו של הקב""ה, גם תפלתו לא יעלה לפניוית',ולז""אהכתוב גם כי תרבו תפלה אינני שומע וגו'"
Divrey Yoel,Shemot,33,380,"והנהאם יתבונן האדם בחומר עונש הזה רעדה יאחזהו ותסמר שערות אנוש,דהלאכל ישראל צריכים לרחמי שמים בכל עת ועונה ומתחנניםלהבוית""שבתפלות ותחנונים וכל קיומםותקותםשיקובלולרצון לפניוית""ש,והבוי""תשומע תפלת כל פה ואף תפלת החוטאים,וכמשרז""ל(ר""ה י""ז ע""ב) נתעטף הקב""ה כשליח ציבור והראה לו למשה סדר תפלה, א""ל כל זמן שישראלחוטאיןיעשו לפני כסדר הזה ואני מוחל להם, ואיך אפשר להעלות על הדעת שתפלות ישראל לא יחשבו לכלום ח""ו, עד שאפילו מרבים בתפלות לא יתקבלו כמאמר הכתוב גם כי תרבו תפלה אינני שומע, ואי' איפהתקותינובדור השפל הזה שאין אתנו יודע מה היא תפלה ותחנה, אולם מצינו רמז נחמה בפסוק שלאחריודכתיבהזכו הסירו רוע מעלליכם מנגד עיני,פרש""יי' אזהרות של לשון תשובה יש כאן כנגד עשי""ת, וכנגד עשרהמלכיותזכרונותושופרות, הרי מבואר שמועיל תשובה אף לחטא הידוע דבי'מייריהכתוב, גםבזוה""קפרשה זו מבוארדמהניתשובה וז""ל מאןדמשקרבברית וכו' לית לי'חולקאבאלקיישראל אי לאבחילאדתיובתאתדיר עכ""ל,ומ""שבתיובתאתדיראפ""לע""דשאה""כוחטאתי נגדי תמיד,דהנהבשאר עוונות אם התודה עליהם ביוה""כ שעבר ולא שנהבאולתואיכא פלוגתא אם צריךלהתודותעליהםעוה""פ, (עיי' בגמ' ובטוראו""חסי' תר""ז) אבל על חטא הידוע צריך לעשות תשובה ולהתוודות עליו תמידכמאה""כוחטאתי נגדי תמיד."
Divrey Yoel,Shemot,33,381,"ראהמש""כבספה""קדברי חיים (פ' נח) לפרש הכתוב קץ כל בשר בא לפני וגו'וזל""ק,דהנהמבואר שחטא של דור המבול הי' ששחתו זרעם ולזה לא מהני תשובהוכו', וכן באמת דור המבול לא הי' מהני להו תשובהוכו', ואך עיקר הדבר למסור נפשו להקב""ה בהשתוקקות רב עד דכדוכה של נפש, ומתוקן בזה מה שחרבו העולמות ובא עד הקץ, ולזה אמר הכתוב שפיר קץ כל בשר וגו' עיי""ש, וכתב שם עוד הטעם מדוע לא מהני תשובה על חטא הזה, עפ""י מהדמבוארבספריםדבחטאפוגם האדםבמדותיו,ובמדהשחוטא מסיר עצמו משרשי הקדושהוכו', אבל לא נעקר ח""ו משרשו ולכן בעשותו תשובה מביא חיות חדש משרשו אל האבר והצינור שנחלשוכו', אך בחטא חמור הנ""ל ר""ל הוא כמסיר שרשו לגמרי כמבוארבספה""ק, ולכן כמעט אין לו תרופה, ואך בקושי תשובה מעורר אדם הנהגה רצונית למעלה מהטבע,יחוןונעתר לה' גם בשובו מחטא זהוכו', והיינו כנ""ל ע""ימסנ""פממש להקב""ה עכת""ד."
Divrey Yoel,Shemot,33,382,"ובזהיל""פהפסוק הסירו רוע מעלליכם מנגד עיני וגו'דלכאורהמאמר מנגד עיני צ""ב, דאף שזה ודאי רק לסבר את האוזן, כי אצל הקב""ה לא יתכן שום בחי' גשם כלל, אבל עם כל זה צ""ב מה צורך לומר מנגד עיני ומהו הכוונה בזה,ונל""פדהנהישחושביןבלבם, כי בזה שעבר עליהם רוח חרטה פעם אחת ולעתים נשבר לבו בקרבו, כבר יצא ידי חובת תשובה כראוי ונמחק החטא, ע""כ השמיענו הפסוק שלא די בזה, כי אם רחצו הזכו הסירו רוע מעלליכם מנגד עיני, כלומר שתהי' התשובה כ""כ עד שיוסרהעוןגם מנגד עיני, וע""ד שכתב הרמב""ם ז""ל בה' תשובה עד שיעיד עליו יודע תעלומות שלא ישיבלכסלהעוד."
Divrey Yoel,Shemot,33,383,"או""יעפי""משפירשובספה""קאמרינו בתפלת ר""ה כי זוכר כל הנשכחות אתה, ר""ל דאם אדם עושה מצוה וזוכרו להתפאר בו אז נשכח זכותו למעלה, ורקאם אינו מתפאר בו וה""הבבחי' שכחה אצלו אזמזכיריןזכותו למעלה, וכמו""כ בעבירות מי שחטאתו נגדו תמיד ומתאונן ע""ז כל ימי חייו אז איןמזכיריןחטאו למעלה, אבל אם שוכח עוונותיו אז נזכר החטא ח""ו למעלה,וז""שזוכר כל הנשכחות שהקב""ה זוכר מה שנשכח מלב האדם,ואפ""לבכוונת הפסוקמ""שהסירו רוע מעלליכם מנגד עיני ולא אמר מנגד עיניכם כי צריך שיהיולזכרוןבין עיניך תמיד ויהי' לבו נשבר בקרבו, מה נאמר ומה נדבר ורחוקים אנחנומבחי' זו הרבה מאוד, אבלעכ""זכל נקודה של תשובה מועיל קצת להחליש כובד החטא, וידוע פתגםהרה""קהר""רזושאזלה""הכי מעולם לא ראה מלאך הנברא מעבירות ישראל שיהי' שלם בגופו ואבריו, כי האדם החוטא מתאנח על העבירה שעשה, והאנחה שוברת גופו של המלאך הנברא ממעשה החטא ונעשה מחוסר אברים,ועד""זי""ללעניןתפלה,דמ""שרז""לדהמוציאזרע לבטלה נדחה תפלתו ר""ל, היינושהמקטריגיםמונעים ומעכבים תפלתו מלעלות, אבל כ""ז רקבשלאעשה תשובה, אבל ע""י תשובה מחלישכחהמקטריגיםוהבוי""תברוב רחמיו וחסדיו חותר חתירה ומקבל אותם, כי קרוב ה' לכל קוראיו לכל אשר יקראוהו באמת."
