book_name,parsha_name,dvar_torah_id,passage_id,passage_content
Divrey Yoel,Shemot,19,252,"וע""דהרמז פירשובספה""קשובו בנים שובבים חוץ מאחר עפ""י מאמרם ז""ל (ע""ז י""ט ע""א) אשרי איש ירא את ה' אשרי איש ולא אשריאשה,אר""עא""ראשרי מי שעושה תשובה כשהוא איש,ופירש""יכשהוא בחור בכוחו, כלומר ממהר להכיר בוראו קודם ימי הזקנה עכ""ל, האמנם שגם התשובהשעושיןבימי הזקנה מועלת, כמ""ש הרמב""ם ז""ל (פ""ב מהל' תשובה) שאפי' עשה תשובה ביום מיתתו כל עונותיונמחלין. אולם תשובה המעולה כשהאדם שב בבחרותו כשהוא איש,וז""פשובו בנים שובבים חוץ מאחר, ר""ל טרם הגיעו ימי הזקנה שכבר נחלשכחוונעשה כאיש אחר, ויזדרז האדם ולא יאחר זמנו רק יעשה תשובה כשהוא עדיין בכוחו והחייתןאל לבו. ונ""ל להוסיף נופך עפ""י דרכם,דהנהבכלעוןשהאדם עושה נעשה פגם בנפש ונשתנה בחינת נפשולגריעותא,ורואיןזאת בחוש שכל מה שהאדם משוקע ר""ל בעונותיו יותר משתנים השקפותיו ורצונותיוודיעותיו, ומתמעט חשקו ורצונו לענייני קדושה ממה שהי' לו תחילה קודם החטא, ונשתנה לאיש אחר ממש בכל חפצו ורצונותיו,וז""פשובו בנים שובבים חוץ מאחר, שיעשו תשובה קודם שיתהפך ע""י הרגל החטאים לאיש אחר ממש, אמנם ע""ישחוזריןבתשובהיהפךלאיש אחרלטיבותאוכמ""ש הרמב""ם ז""ל (פ""ב מה' תשובה הלכה ד')יעיי""ש."
Divrey Yoel,Shemot,19,253,"עודנרמז במאמר רז""ל שובו בנים וכו' חוץ מאחר,עפימ""שהמקובלים שע""י החטא לפעמים נתחלף נשמתו בלילה ונדבק בו נשמת עכו""ם או עבד, הביאוהמג""אלהלכה (סימן מ""ו) שע""כ יכול גם גר לברך ברכת שלא עשני גוי, והכוונה על יציאת נשמתו בלילה שלא נדבק בה נשמת עכו""ם עיי""ש, והנה אם ח""ו נתחלף נשמתו הטהורה חלק אלוקי בנשמת עכו""ם או עבד, אז קשה מאוד לחזור בתשובה מפנימיות הלב, כי אותה הנשמה אינה מסוגלת להשפעת קדושה כזה, וע""כ צריך האדם שיזדרז לחזור בתשובה טרם שיתהפך לאיש אחר בסיבת עונותיווז""פשובו בנים שובבים חוץ מאחר, ר""ל קודם שנתחלף לאיש אחר ע""י התחלפות נשמה, וצריך לשום אל הלב ולהרבות בתפלות ותחנונים לפני הקב""ה, ובפרט בימים הללוהמסוגליןלתיקון חטא הידוע צריך כ""א להתאמץ שלא יעברו הימים הללו בלא תשובה ותיקון המעשים שנזכה להתקרב לפניהבוכ""ע."
Divrey Yoel,Shemot,19,254,"עודאפ""לברמז אמרם ז""ל חוץ מאחר, בהקדם לבארמאמה""כויקםמלך חדש שנחלקו בוחכמז""לח""א חדש ממש וח""אשנתחדשוגזירותיו,ובמד""ריש עוד דעה שלישית רבנן אמרו למה קראו מלך חדש והלא פרעה עצמו הי' אלא שאמרו המצריים לפרעה בא ונזדווג לאומה זו, א""ל שוטים אתם עד עכשיו משלהם אנו אוכליםוהאיךנזדווג להם, אילולא יוסף לא היינו חיים, כיון שלא שמע להם הורידוהומכסאוג' חדשים, עד שאמר להם כל מה שאתם רוצים הריני עמכם והשיבו אותו לפיכך כתיבויקםמלך חדש עכ""ד המדרש, ויש סתירה לזה מדבריהמד""רעה""פ ויאמר אל עמו הבהנתחכמהוגו' הוא התחיל בעצה תחלה לכך לקה תחלה, הוא התחיל בעצה תחלהדכתיבויאמר אל עמו וגו' והוא לקה תחלהדכתיבובכה ובעמך ובכל עבדיך וגו' ובמאמר הנ""ל דרשו רז""ל שלא רצה להרע לישראל עד שהורידוהומכסאוג' חדשים, והוא סתירהלמ""שהוא התחיל בעצה תחלה, גם צ""ב דלא יעלה על הדעת שהי' פרעה הרשע אוהב את ישראל, ואיך פתאום הי' לומסנ""פכזה שסבל בשביל הצלתם הורדה ממשלתו על ג' חדשים."
Divrey Yoel,Shemot,19,255,"עודאיתאבמד""ר(שם) רבנן פתחיןפתחאלהאיקרא (הושע ב') בה' בגדו כי בנים זרים ילדו עתה יאכלם חדש את חלקיהם, ללמדך כשמת יוסף הפרו ברית מילה אמרו נהי' כמצריים, וכיון שעשו כן הפך הקב""ה האהבה שהיו המצרייםאוהביןאותן לשנאה שנאמר (תהלים ק""ה) הפך לבם לשנוא עמו וכו' וצריך ביאור להבין ענין אהבת ישראל זו שהיו המצרייםאוהביןאותן מה טיבו, ולאיצויירשהרשעים יאהבו את ישראל אהבה גמורה, וכבר אמרתיבזה שלא הי' כוונת פרעה לטובת ישראל במה שלא רצה לשעבד עמהם, אבל התחכם וחשב שעל ידי דרך של התקרבות ואהבה ירחקם יותר משורשהקדושה, וכמבואר בזוהר הקדוש פרשה זודקשויהשיעבודוההתרחקות מהמצרים הי' טובה גדולה לישראל,שעי""זלאנתערבובין המצריים וזכו לקבלהתוה""ק, ע""כ הלך פרעה בדרך זו לקרב אותם והכניס אהבת ישראל בלב המצריים, ופעל בעצתו שרוב גדול מישראל לא רצו לצאת ממצרים ע""י שנתן להם פרעה פטרונים והי' להם כל טוב, וא""ש אמרם ז""ל שפרעה התחיל בעצה תחלה, אך לא בעצת השעבוד אלא עצה יותר רעה ממנה דהיינו דרך אהבה והתקרבות, וידעהבוי""תשאם ימשכו בדרך הזה לאישארח""ו שריד ופליט לבית ישראל, וע""כ הפך לבם לשנוא עמו וניצולועי""זעכ""פ ס'רבואשיצאו ממצרים."
Divrey Yoel,Shemot,19,256,"ונקדיםעוד לבארבמאמה""כ(פ' וירא) וה' אמר המכסה אני מאברהם וגו' כי ידעתיו למען אשריצוהאת בניו ואת ביתו אחריו ושמרו דרך ה' וגו'פירש""יז""ל כי ידעתיו לשון חבה וכו' ולמה ידעתיו למען אשריצוה, לפי שהוא מצוה את בניו עלי לשמור דרכי, ואם תפרשהו כתרגומו ארי גלי קדמי, יודע אני בושיצוהאת בניו וגו' אין למען נופל על הלשון עכ""ל, ולכאורה צריך להבין פי' התרגום שהוא מפי ר""אור""יואמרז""לשניתנה מסיני, ואיך יתפרש הפסוק לפי' התרגום. ויתבאר ע""ד הכתוב בפרשה זו ויראאלקיםאתבנ""יוידעאלקים,פירש""ינתן עליהם לב ולא העלים עיניו עכ""ל, והכוונה כי סר מעליהם הסתרת פנים שהי' עד עכשיו, וכן פי' תרגום אונקלוס וגלי קדם ה'שעבודאדבנ""י, ובתרגום יונתן פי' באופן אחר וגליקדמוייתתיובתאדעבדובטומראדלא ידעואנשבחברי' וכן דרשובמד""רויראאלקיםשעשו תשובה וכו' וידעאלקיםשאפי' אחדבחבירולא הי' יודע אלא הקב""ה לבדו, ואף שהיו משוקעים מאדמהשיעבודאעפ""כ הי' להם הרהורי תשובה ולא היומכיריןבהם ורקהבוכ""עידע פנימיות לבם, עכ""פ ידיעתאלקיםמורה על ידיעה הפנימיות שבלב שאין זולתו יודע כ""אהבוי""תהבוחן כליות ולב."
Divrey Yoel,Shemot,19,257,"ועד""זיתבארמאמה""ככי ידעתיו למען אשריצוהאת בניו וגו' ושמרו דרך ה' וגו' למען הביא ה' על אברהם את אשר דבר עליו,דלכאורהמה רבותי'דאברהםאבינו שכך הוא מצוה את בניו ושמרו דרך ה' ומצוי גם בסתם בנ""א אם לאנפסדועדייןבדיעותנפסדות, גם הם מצווים ומדריכים את בניהם שישמרו דרך ה', ואף אם הם בעצמם לא יוכלו שליט ביצרם מ""מ יש להם תשוקה ורצון להדריך בניהם שישמרו התורה ומצות, ומהו הרבותא שמשבח הכתובלאאע""הבכך. אך נראה שיש בזה ענין עמוק, כי מי שחפץ באמת שבניו ילכו בדרך ה', צריך מקודם לקשר לבב עצמולהבוכ""עביראת ה' כל היום, וכעין שפי' ק""ז הייטב לבזלה""ה(פ' נח) הכתוב יראת ה' טהורה עומדת לעד,עפי""משכתבובספה""קההבדל בין יראת עונש ליראת הרוממת, כי היראמכחסיבת העונש אותה יראה אינו יכול להורישה לבניו כי איננה קנין עצמי, אבל הירא מרוממותו יתעלה, אותה יראה מוריש ומנחיל לבניו אחריו, והיינודכתיבמייתןוהי' לבבם זה להם ליראה אותי וגו'דייקאכל הימים יראה תמידית, למען ייטב להם ולבניהם לעולם,וז""שמתהלך בתומו צדיק אשרי בניו אחריו עכ""ד,וז""שיראת ה' טהורה עומדת לעד כלומר לדורותיו אחריו, עיי""ש. וכמו""כ אברהם אבינו הי' מקשט ומטהר את נפשו לא בשביל תועלת עצמי, אדרבה הפקיר נפשו וכל מאודו בשביל לעשות רצון קונו, וזהו אשר נשאר לדורותיו שיתקיימו לעד ולא תשכח מפי זרעו, ואף בגודל השפלות כל הקיום שלנו רק בזכות האבות הקדושיםובכחעבודתם שעבדוהבוי""תבכל לבם ונפשם,וז""פהכ' כי ידעתיו שהקב""ה נתן לב עליו לידע פנימיות לבבו איך הוא מטהר ומקדש עצמווכחזהישארנצחי לדורות, והכוונה באומרו כי ידעתיו ע""דשאמה""כוידעאלקים, שהי' גלוי וידוע לפניוית' פנימיות לבבו, מה שעבד השי""תבמסנ""פוהשתוקקות גדולה עד להפליא כדי שיהי' בטוח בדורות הבאים אחריו שישמרו דרך ה' וגו',ולפי""זשפיר נופל לשון למען אף לפי' התרגום, כי אין כוונת הידיעה על מה שהוא מצוה את בניו וביתו אחריו, רק על בחינת העבודה שלו בפנימית הלב, איך הוא מוסר נפשו בעבדות השי""ת, והכל למען אשריצוהאת בניו וביתו אחריו שיהי' בטוח בבניו אחריו שילכו בדרך השי""ת, וזהו יסוד גדולבעניןחינוך הבנים לקשט את עצמו תחילה בפנימיות הלב ואזישארהשפעת הקדושה אחריו לדורותיו."
Divrey Yoel,Shemot,19,258,"עכ""פמלת ידיעה משמש ב' לשונות לשון אהבה וחיבהכפירש""י, ולשון ידיעה והכרה כפי' התרגום, ובזה יתפרש לשון הכתובויקםמלך חדש אשר לא ידע את יוסף.דהנהמתחלה היו פרעה והמצריים אוהבים את ישראל כמבואר במדרש הנ""ל ואח""כ הפך הקב""ה אהבתם לשנאה, מגודל רחמנותו על ישראל שלא יתערבו ח""ו בין המצריים,ולז""אויקםמלך חדש אשר לא ידע את יוסף, ויתפרש ידיעה מלשון חיבה שלא הרגיש אהבה ליוסף ולישראל שכולם היו גידולי יוסף, וזה לא הי' דמיון כ""א באמת לא ידע את יוסף, ושפיר כתבההתוה""קאשר לא ידע את יוסףלפרש""יבפ' וירא שפי' מלשון חיבה, אמנם בחיצוניותו עדיין הי' בוש להראות שנאה כבושה כ""כ נגד ישראל, מפני כבודו של יוסף שבזכותו היו חיים עד עכשיו, לזה עשה את עצמו כאילו אינו יודע ואינו מכיר את יוסף. נמצאדמאמה""כאשר לא ידע את יוסף יתפרש בשני הפירושים כפי' רש""י ופי' התרגום, לפיפירש""יהי' אמת גמור שלא הי' לו אהבה וחיבה ליוסףומה""טנכתב בתורה שהאמת כן הי', גם מרומז בה הדרש שעשהא""עכאילו לא ידע את יוסף ויתפרש מלת ידע כפי' התרגום, וזה הי' דמיון כוזבת, אלא שהשנאה הכבושהבלבוהביא אותו לכך, ושני הפירושיםאיתנייהוותלוייםזב""ז."
Divrey Yoel,Shemot,19,259,"א""יעפי""משפירשתי (פ' בהעלותך) מהדאיתאבמדרש רבה (פרשת לך פ' מ""ב סי' ג') ויהי בימי אחז מה צרההיתהשם וכו' כך אמר אחז אם אין גדיים אין תיישים וכו' אם אין קטנים אין תלמידים אם אין תלמידים אין חכמים וכו' למה נקרא שמו אחז שאחז בתי כנסיות ובתי מדרשות ע""כ, ובפשטות הכוונה שביטל בתי מדרשות ולא הניח שילמדו תורה, אם כן לכאורה אין שייך לקרותו אחז על שם שאחזבתכנ""סדאדרבהביטל אותם. ומילת אחז משמעותו להיפוך שאחז בהם להחזיקם ולקיימם, ופירשתי דלפי שרצה בביטולבתכנ""ס, התחכם שאם ילךבכחכפי' וגזירות לא יועילו מעשיו,שבנ""יילמדו תורהבמסנ""פ, לזה הלך בדרכו של פרעה להראות התקרבות ואהבה, ופיזר ממון להחזיק ישיבות ובתי מדרשות, ובזה יכניס שיטתו בלב לומדי תורה, ומעצמם יבטלו אח""כ בתי כנסיות ובתי מדרשות, כמושרואיןדרך הזהבדורינו, שהרשעים עוקרי הדת מתאמצים ורוצים בהחזקת ישיבות ובתי ת""ת, ויודעים שזהו ביטולה של תורה ר""ל, מה שרשעים מחזיקים בקיומם של בתי מדרשות, ובזה יובן דברי התרגוםדמתחלהכשהלך פרעה בדרך של התקרבות ואהבה, שזה לא הי' לטובת ישראל וכנ""ל, רק אדרבה להרחיק אותםעי""זמן הקדושה, הי' פרעה עצמו מחזיק בתי מדרשות במצרים שיוכלו ישראל ללמוד שם תורה ולקיים גזירת יוסף, היינו גזירת אורייתא שגזרו יוסף והשבטיםהק', וכמ""ש ואת יהודה שלח לפניו אל יוסף להורות לפניוגושנהופירש""ילתקן לו בית תלמוד שמשם תצא הוראה, ופרעה עצמו הי' מחזיק בידם מכיס המלוכהשעי""זיתרחקו מן הקדושה, אבל אח""כ שינה את דרכו דרך התקרבות, כנ""ל במדרש שהמצריים לא רצו בזה ונקטו להם דרך של שנאה גלוי', ומאז לא קיימו עוד גזירת יוסף."
Divrey Yoel,Shemot,19,260,"ומהשקורא אותו מלך חדשנל""פעפי""מדאיתאבגמ' (סנהדרין ק""ה ע""א)אר""נחוצפאאפי' כלפי שמיא מהני, מעיקרא כתיב (בבלעם) לא תלך עמהם ולבסוף כתיב קום לך אתם, ולכאורה הוא פלא,התינחלגבי בנ""א יתכן לומרשחוצפאמועלת להיעשות רצונו מפני היראה. אבל כלפי שמיא איך שייך שחוצפה ישנה דעתו ורצונוית' חס מלהזכיר ובאמת יש טעם אחר בגמ' (מכות י') מדועבתחלהאמר לו הקב""ה לא תלך עמהם ואח""כ קום לך אתם,דבדרךשאדם רוצה לילך בהמוליכיןאותודכתיבלא תלך עמהם וכתיב קום לך אתם, ונקדים עודמאמרז""לשם אמר רב ששתחוצפאמלכותאבלאתאגא,דכתיבואנכי היום רך ומשוח מלך והאנשים האלה בניצרוי' קשים ממני וגו',פירש""ימלכותאבלאתגאכלומר שררה גדולה ואינו חסר אלא כתר מלכות, אנכי היום רך וגו' כלומר איני גדול מהם אלא משיחת מלכות עכ""לוצ""בהכוונה."
Divrey Yoel,Shemot,19,261,"ונל""פבהקדם דבריהמהרש""אבמס' מכות (דף י') לפרש אמרם ז""ל בדרך שאדם רוצה לילךמוליכיןאותו, וז""ל הכוונה הוא שידוע שכל מחשבהדיבור ומעשה האדם הנה הוא בורא לו מלאך לפי עניינו אם לטוב אם לרע, ולכן כפי רצונו ודעתו של האדםמוליכיןאותו אותן המלאכים הנבראים מאותו רצון ומחשבה אשר בו עיי""ש שהאריך, וכוונתודאותוהמלאך רע שנברא מרצונו הרע, הוא שאמר לו קום לך אתם היפך רצוןהבוב""ה, דלא יתכן שנוי רצון לפניוית', אבל לפי שברצונו של בלעם הי' לילך להרע לישראל נבראו ממחשבתו זאת מלאכים רעים. והם שאמרו לו קום לך אתם,ועד""זיתפרש הכוונה בדברי ר""נחוצפאכלפי שמיא מהני, אינו ר""לדמהנילנגד הקב""ה לשנות דעת עליון ח""ו ע""יחוצפא, אלא ר""ל שנבראים ע""יחוצפאמלאכים רעים והם הגומרים ענינו ועושים את רצונו, וכמו שאמרו לבלעם קום לך אתם היפוך רצון השי""ת שאמר לו לא תלך עמהם, נמצא שדרש זה מכוון עם מה שאמרו במס' מכות בדרך שאדם רוצה לילךמוליכיןאותו, ושני הדרשות בקנה א' עולים."
Divrey Yoel,Shemot,19,262,"ובזהיובן גם מאמר הסמוכה אליוא""רששתחוצפאמלכותאבלאתגא, והכוונהדע""יהחוצפאבורא מלאכים רעים והם נותנים בידוכחשררה להרע נגד רצונוית', והן הן המחוצפים ועזי פנים שבדור שיש להם שררה ומלוכה ואינו חסר להם אלא כתר מלכות,ומולכיןנגד רצון השי""ת שכךהיתהרצון הבריאה שיהי' הבחירהחפשיתוביד האדם לברוא לו מלאכים רעים ולהעמיד בכוחםמלכותאבלאתגא. וזה ירמוז אמרם ז""ל שובו בנים שובבים חוץ מאחר ר""ל עד שלא ימשלו בו מלאכים רעיםמסטראאחרא בחי'אלהיםאחרים. דאז כבר קשה התשובה וכמעט נתבטל בחירתו כמו שאמרו רז""ל בדרך שאדם רוצה לילךמוליכיןאותו, היינו אפי' נגד רצונו."
Divrey Yoel,Shemot,19,263,"ונקדיםעוד מ""ד בתנא דבי אלי' (א""זפ""ג)הכלברא הקב""ה בעולמו חוץממדתשקר ומדת עולה שנאמר הצור תמים פעלווכו', עושה אדם עצמו לדבר אמתמוסריןלו מלאך שמתנהג עמו בדרך צדיקים ומדבר אמת, ואם עושה אדם עצמו רשע לכחש ולשקר, מוסרים לו מלאך שיתנהג עמו בדרך רשעים ומכחש ומשקר וכו' ע""כ, והנה גם המזיקיםומקטריגיםהם בריאה מהקב""ה שכךהיתהרצון הבריאה שיהי' עולםהנסיוןולכולם יש שורשמתחלתהבריאה חוץ מאותן המלאכים הנבראיםממדתהשקר והעולה אין להם שורש בבריאה רק האדם בעצמו בורא אותם במעשיו. ובזה יובן מה שקראוחכז""לאתהיצה""רבשם מלך זקן וכסיל, ובפשטות נקרא מלך מפני שהוא מושל על האדם וזקן מפני שבאמתחלתלידתו,משא""כהיצ""טרק כשנעשה בן י""ג שנה, ונקרא כסיל מפני שמכניס רוח כסילותבבנ""אכמשז""לאין אדם חוטא אא""כ נכנס בו רוח שטות, ולדרכינו נאמר עודדע""כנקראהיצה""רבשם זקן מפני שהוא עומד על שירותומתחלתהבריאה,שהכלברא הקב""ה בעולמו גם אתהיצה""רוהמקטריגים, ולזה נקרא זקן,משא""כאותןהמקטריגיםשנבראים מהשקר ועולה הם בריאה חדשה ואינם ראוייםלהקראבשם מלך זקן אלא מלך חדש, שיש להם מלכות ושררה על האדם כמו שפירשנוחוצפאמלכותאבלאתגאאבל הם חדשים מקרוב באו, ולא היומתחלתהבריאה וגם אינם משעת לידה כמוהיצה""ר,וז""שהכתובויקםמלך חדש על מצרים,שנתחדשוגזירותיו על ישראל וע""י מדת העולה ברא מלאך רע לפי ענינו והוא חדש ממש שאין לו שורשמתחלתהבריאה, והמלאך הרע נעשה מלך על מצרים כי כל תהלוכות המדינה ע""י המלך, והוא עצמו הי' מתנהג ע""י המלאך הרע שנברא מרצונו, ושפיר אמרויקםמלך חדש חדש ממש,ומ""שאשר לא ידע את יוסףקאיג""כ על אותו המלאך שהוא מלך החדש אשר קם על מצרים, ובאמת לא ידע את יוסף כי לא הי' עדיין בעולם בחייו של יוסף, ומה שדרשו ז""ל עשהא""עכאילו לא ידע את יוסף הכוונה על פרעה שהי' מרכבה אליו והוא ידע את יוסף אלא שעשהא""עכאילו לא ידע והלך בדרך כוזב, נמצא דב' הדרשות שדרשו חז""לבמאמה""כויקםמלך חדש אשר לא ידע את יוסף שניהם קיימים ואמיתיים ותלייןחדאבחבירתאדע""ישעשה עצמו כאילו לא ידע את יוסף וחידש גזירותיו ברא לו מלאךממדתהשקר ועולה ואותו המלאך לא ידע את יוסף באמת, שלא הי' עוד בעולם בחייו של יוסף ושפיר אמר אשר לא ידע את יוסף."
Divrey Yoel,Shemot,19,264,"ולדרכינוי""לבכוונת דבריהם ז""ל (סוף מסכת סוטה מ""ט ע""ב) בעקבותמשיחאחוצפאיסגאשיתרבה החוצפה ויהי' להם מלוכה וממשלה כמושאמרז""לחוצפאמלכותאבלאתגא,ובעוה""רהקימו לעצמם מלכות ישראל נגדהתוה""ק,ומפיציןכפירה ומינות בכל העולם ויש להם שררה על ישראל והם הנקראיםחוצפאמלכותאבלאתגאועליהםנתנבאוחכז""לברוח קדשם, ה'ישמרינומהם ומהמונםוהשי""תיציל את עמו ישראל מרעיונות של כפירה, והמודה להםרח""לה""ה כופרבהשי""תובתורתוהק', וידועשק""זהייטב לב אמר בנוסח התפלה ושבור עולהגויםועול הגליות מעלצוארינו. ואמר שהכוונה על שני בחי' של גלותגלותשל גוים ומהשסובליןגלות מרשעי ישראלוז""שועול הגליות,ובדורינועכשיו נרגש הרבה עול הגלות הזהוכוונתינובתפלה שיעזור לנו השי""ת וישבור מעלינו עול הגלות של רשעי ישראל, ומקושר אלמ""שאח""כ ותוליכנו מהרה קוממיותלארצינו, שע""ישיתבערוהרשעים מן הארץ נוכל לבוא לארץ הקדושה קוממיות בשמחת הלב בקדושה ובטהרה ברצוןהבוב""הע""י ביאת המשיח בהתגלות כבוד שמים עלינו במהרה בימינו אמן."
